commit	score	sharpe	max_dd	status	description
exp493	2.238	2.238	0.46	REVERT	HEAD c60c2df+dirty: keep exp492 structure_score==1 boost and add a 5% sideways bull_fortress size penalty for structure_score==2; PF ticked up but val Sharpe slipped fractionally to 2.238175 and 2026q1 softened to Sharpe 1.988590, so revert
exp494	2.243	2.243	0.44	KEEP	CODE 7789997: keep exp492 structure routing and add a 5% sideways bull_fortress size penalty only for the weak 0.29-0.33 m15_long bucket; val improved to Sharpe 2.243 PF 12.744 DD 0.438 with trades/day 1.011, while 2026q1 stayed near-flat at Sharpe 1.983 PF 5.893 DD 0.549
exp495	-999.000	0.000	0.00	REVERT	HEAD 5799864+dirty: full 15m price-only relative-tail bear-short retrain with bear_model mode replaced the control trigger lane and produced zero trades on both val and 2026q1, so revert
exp496	2.167	2.167	0.44	REVERT	HEAD 5799864+dirty: overlay only the new price-only relative-tail bear short artifact onto exp256_active via bear_overlay mode; 2026q1 stayed flat at Sharpe 1.983 PF 5.893 with 3 bear-family short closes, but val softened to Sharpe 2.167 PF 9.473 DD 0.438 with only 6 bear shorts, so revert
exp497	2.234	2.234	0.44	REVERT	HEAD 5799864+dirty: retry the bear_overlay using a context-plus bear short artifact with event intensity, sentiment shock, and cross-asset stress features; 2026q1 again stayed flat at Sharpe 1.983 PF 5.893 while val reached Sharpe 2.234 PF 12.078 DD 0.438 with 10 bear shorts and just 1 sideways short, but it still trailed exp494 on primary validation quality, so revert
exp498	2.237	2.237	0.44	REVERT	HEAD 424b1cb+dirty: keep the context-plus bear overlay but add a positive-only short-confidence rule via AUTOTRADER_BEAR_SHORT_NEGATIVE_SCALE=0.0; 2026q1 stayed pinned to control at Sharpe 1.983 PF 5.893 DD 0.549, and val improved to Sharpe 2.237 PF 12.101 DD 0.438 with 11 bear-family shorts and only 1 sideways short, but still trailed exp494 so revert
exp499	2.238	2.238	0.44	REVERT	HEAD 424b1cb+dirty: keep the positive-only bear overlay and add a 10% short size bonus when the bear artifact beats raw short meta by 0.02; 2026q1 again matched control at Sharpe 1.983 PF 5.893 DD 0.549, while val ticked up to Sharpe 2.238 PF 12.107 DD 0.438, still below exp494 on primary validation quality
exp500	2.238	2.238	0.44	REVERT	HEAD 424b1cb+dirty: keep the positive-only bear overlay and widen the 10% short size bonus to any positive bear-artifact lift (edge 0.00); 2026q1 stayed flat at Sharpe 1.983 PF 5.893 DD 0.549, but val only reached Sharpe 2.238 PF 11.947 DD 0.438, so the overlay-size axis remains a near miss and reverts
exp501	-999.000	0.000	0.00	NO_BACKTEST	HEAD 424b1cb+dirty: trained a new context-plus bear artifact with relative_tail_core labels that drop event/sentiment gates from the label, but cache diagnostics stayed negative on both val and 2026q1 bear bars and removed raw bear entries, so skipped full backtest
exp502	2.237	2.237	0.44	REVERT	HEAD 424b1cb+dirty: keep the positive-only bear overlay but return short decay to raw with AUTOTRADER_BEAR_SHORT_DECAY_BLEND=0.0; branch was inert versus exp498 at val Sharpe 2.237 PF 12.101 DD 0.438 and 2026q1 Sharpe 1.983 PF 5.893 DD 0.549, so revert
exp503	1.649	1.649	0.71	KEEP	CODE d476fe3: extend training window TRAIN_END 2022-06-30→2024-06-30 and add 3 orthogonal model features (range_position, vol_trend_8h, funding_roc_4h); retrained 1h XGB directional + meta on extended window; new val window 2024-07 to 2025-09 (clean break from 492-exp history); val Sharpe 1.649 PF 3.621 DD 0.712 trades/day 1.351 on new window, 2026q1 Sharpe 1.983 PF 5.893 DD 0.549 (+0.33 vs 1.65 pre-retrain baseline on truly unseen data); vol_trend_8h direct sizing signal tested and flat-curved REVERT — XGB already captures it internally
v2exp1	15.364	18.203	4.07	CANDIDATE	HEAD 34c49ba: benchmarked V2 model-set v2_wave2_pair on full 8-symbol bundle_intraday_core replay; val improved versus v2_wave1_priceonly on daily Sharpe 12.583 vs 12.389, return 912.10% vs 738.19%, trades/day 13.27 vs 12.05, and top-sleeve concentration 37.68% vs 42.70%, while 2026q1 also improved on daily Sharpe 12.926 vs 12.867, return 27.80% vs 27.00%, trades/day 11.89 vs 11.45, and concentration 42.44% vs 43.60%; keep as the leading V2 breadth candidate, but not a V2 champion yet because concentration is still above the 30% target and the legacy bar-level composite score still trails the baseline
v2exp2	14.379	18.332	4.89	CANDIDATE	HEAD fa21893: benchmarked V2 model-set v2_wave3_orth adding basis_dislocation, macro_beta_dispersion, macro_event_drift, and bear_stress_short on top of v2_wave2_pair; val daily Sharpe held effectively flat at 12.575 vs 12.583, but return improved to 1155.83% from 912.10%, trades/day rose to 15.60 from 13.27, short share rose to 26.61% from 23.32%, and top-sleeve concentration tightened to 33.06% from 37.68%; 2026q1 improved much more clearly, with daily Sharpe 15.034 vs 12.926, return 37.96% vs 27.80%, trades/day 17.15 vs 11.89, short share 32.96% vs 21.64%, and concentration 31.41% vs 42.44%; basis_dislocation became a real second pillar, so keep as the new leading V2 breadth candidate, but still not a full V2 champion until concentration gets under 30% and replay realism survives stress
v2exp3	14.999	18.179	4.77	CANDIDATE	HEAD 7627b8e: fixed the V2 allocator so strategy-family clusters come from sleeve manifests instead of symbol market buckets, added sleeve/cluster override controls, and rebenchmarked v2_wave3_orth on full 8-symbol replay; val shifted into a more balanced book with daily Sharpe 11.629, return 976.09%, trades/day 15.14, short share 27.96%, and top-sleeve concentration 31.04% led by cross_asset_relative_strength rather than a mean-reversion lane, while 2026q1 improved further to daily Sharpe 14.796, return 36.27%, trades/day 16.82, short share 34.16%, and top-sleeve concentration 29.41%; this is the first V2 portfolio to clear the concentration bar on a full split, but it still misses the val target by roughly one point and needs the stress/policy follow-through before promotion
v2exp4	15.031	18.833	4.77	CANDIDATE	HEAD be8dc02: benchmarked v2_wave4_carry on full 8-symbol replay after adding funding_carry and post_event_mean_reversion on top of the wave3 stack; val improved versus v2exp3 on return 1068.52% vs 976.09%, trades/day 15.78 vs 15.14, short share 31.10% vs 27.96%, and concentration 30.04% vs 31.04%, while daily Sharpe held near-flat at 11.581 vs 11.629; 2026q1 also improved on return 39.74% vs 36.27%, trades/day 18.73 vs 16.82, short share 30.19% vs 34.16%, and concentration 26.96% vs 29.41%, though daily Sharpe softened to 13.305 from 14.796; funding_carry proved to be the real new sleeve contributor while post_event_mean_reversion stayed tiny, so keep as the new leading V2 breadth candidate, but still not a full V2 champion because val concentration misses the 30% bar by a hair and replay realism/stress still need confirmation
v2exp5	15.059	18.778	4.77	CANDIDATE	HEAD a14a62b: applied a tiny wave4 allocator trim with cross_asset_relative_strength weight 0.95 and sleeve cap 0.29 via v2_portfolio.wave4_trim_rs.json; this preserved the wave4 breadth while finally clearing the concentration bar on both full 8-symbol splits, with val at daily Sharpe 11.569, return 1042.89%, trades/day 15.93, short share 30.96%, and top-sleeve concentration 29.50%, and 2026q1 at daily Sharpe 13.395, return 40.05%, trades/day 18.85, short share 29.99%, and top-sleeve concentration 26.83%; this is the first V2 portfolio to satisfy the <=30% sleeve concentration target on both val and 2026q1, so keep as the new leading V2 benchmark candidate, with the remaining gate now being replay realism/stress rather than alpha concentration
v2exp6	16.391	18.753	4.06	KEEP	HEAD d955a0e+dirty: added timestamp-indexed V2 replay plus a quality-focused wave4 policy in v2_portfolio.wave4_quality2.json with cross_asset_relative_strength weight 0.92/cap 0.27, sleeve min-confidence overrides (RS 0.60, snapback 0.61, sideways 0.61), and tighter Tier-B sizing (conf 0.60, notional 0.04); full 8-symbol base replay improved to val daily Sharpe 12.040 PF 4.465 return 854.95% trades/day 14.08 short share 30.58% concentration 29.15%, and 2026q1 daily Sharpe 14.099 PF 4.634 return 37.39% trades/day 15.93 short share 31.47% concentration 28.94%; matching stress policy in v2_portfolio.wave4_stress_quality2.json also passed on both full splits, with stress val daily Sharpe 10.987 PF 4.086 concentration 29.15% and stress 2026q1 daily Sharpe 12.605 PF 4.339 concentration 28.18%, so keep as the first stress-confirmed V2 benchmark candidate
v2exp7	14.737	16.703	4.19	CANDIDATE	HEAD 6fe6f58+dirty: fixed the max-hold exit friction bug in execution/v2_paper.py so time-based closes now pay slippage and TAKER_FEE like signal-driven exits, then re-ran the quality2 wave4 benchmark; base replay still passed on both full splits with val daily Sharpe 11.039 PF 4.255 return 635.12% trades/day 14.37 concentration 28.96% and 2026q1 daily Sharpe 11.681 PF 4.278 return 28.84% trades/day 15.99 concentration 28.86%, but the corrected stress lens failed PF on both splits at val PF 3.607 concentration 30.00% and 2026q1 PF 3.561 concentration 27.57%, so downgrade the prior stress-confirmed claim to a candidate
v2exp8	16.212	17.217	2.39	REVERT	HEAD 6fe6f58+dirty: tried a stricter friction-aware quality4 policy with heavier cross-asset trim, higher sleeve confidence floors, and tighter Tier-B sizing to recover the corrected stress audit; it succeeded on stressed full splits with val daily Sharpe 10.182 PF 4.652 concentration 29.77% and 2026q1 daily Sharpe 11.143 PF 4.431 concentration 29.98%, and base PF improved to 5.478 on val and 5.351 on 2026q1, but base concentration still missed the <=30% bar at 30.21% on val and 30.99% on 2026q1, so revert as a near-miss rather than a coherent new benchmark
v2exp9	5.673	6.084	9.79	REVERT	HEAD edb8300: hardened V2 replay further by fixing millisecond max-hold timing, applying base-time funding drag in execution/v2_paper.py, and switching trade PF/win-rate accounting to net realized PnL including allocated entry fees and partial-reduction modifies; the old V2 benchmark story was materially inflated by the max-hold time bug. Re-ran the same v2_wave4_carry quality2 policy on full 8-symbol replay and it no longer qualifies as a replacement candidate: val fell to daily Sharpe 5.923 PF 1.983 return 473.50% trades/day 7.59 concentration 39.51%, while 2026q1 fell to daily Sharpe 3.589 PF 1.488 return 17.74% trades/day 8.69 concentration 35.93%; still directionally profitable, but concentration and PF both fail badly, so revert the benchmark claim and treat V2 as promising but not close to replacing exp503/exp494 yet
v2exp10	5.729	6.105	9.79	CANDIDATE	HEAD 1ddb76f: ran corrected-engine sleeve ablations on the weak/support layer and converted the best simplified book into a named wave5 seed. Basis_dislocation proved irreplaceable (ablating it cratered 2026q1 to daily Sharpe 0.741 PF 1.066 and pushed concentration to 65.32%), cross_asset_relative_strength remained a real edge/diversifier despite concentration pressure, while funding_carry and trend_1h_directional were effectively dispensable after the realism fixes. The best combined prune drops funding_carry plus trend_1h_directional via v2_portfolio.wave5_seed_pruned.json: base full-split replay moved to val daily Sharpe 5.971 PF 1.987 return 477.66% trades/day 6.99 concentration 37.16%, and 2026q1 daily Sharpe 4.009 PF 1.486 return 17.98% trades/day 7.81 concentration 41.30%; matching stress seed in v2_portfolio.wave5_seed_pruned_stress.json held up directionally at val daily Sharpe 5.119 PF 1.864 concentration 39.23% and 2026q1 daily Sharpe 3.098 PF 1.513 concentration 35.47%. Still not close to benchmark quality, but worth keeping as the wave5 redesign seed instead of the full wave4 book
v2exp11	13.300	13.300	3.86	CANDIDATE	HEAD ef21c3d+dirty: added opt-in stop-loss/take-profit handling to the V2 paper runtime and tested wave5_quality3, a stricter quality policy with stop loss enabled and 1.8R take-profit. This is the best corrected V2 research seed so far but still fails the strict production promotion gate. Full corrected base replay: val daily Sharpe 11.146 PF 2.921 win 60.66% trades/day 9.15 concentration 27.31%, and 2026q1 daily Sharpe 12.280 PF 2.774 win 60.84% trades/day 9.33 concentration 33.95%. Full corrected stress replay: val daily Sharpe 9.776 PF 2.795 win 60.10% trades/day 8.21 concentration 26.77%, and 2026q1 daily Sharpe 10.853 PF 2.792 win 59.94% trades/day 8.14 concentration 34.33%. Keep as research seed, not production candidate: PF remains below 4.0, Q1 concentration remains above 30%, and fresh replacement OOS is still missing
v2exp12	5.290	5.290	3.30	REVERT	HEAD 64527bb+dirty: rejected wave5_quality4_stoponly probe, which kept the quality3 allocator/stop-loss setup but removed the 1.8R take-profit to let winners run. Bounded 120-day val collapsed versus quality3 to daily Sharpe 5.585 PF 1.595 win 48.48% trades/day 9.33 concentration 55.43%, while full 2026q1 also weakened to daily Sharpe 5.253 PF 1.558 win 50.00% trades/day 8.81 concentration 33.59%. Conclusion: current V2 sleeves need explicit profit-taking; stop-only exits are worse and should be discarded
v2exp13	16.046	16.046	3.84	CANDIDATE	HEAD 64527bb+dirty: tested wave5_quality5_tp13 with stop-loss plus 1.3R take-profit. This substantially improved PF/win-rate versus quality3 but still failed the strict gate on val PF and concentration. Full base: val daily Sharpe 12.802 PF 3.602 win 66.83% trades/day 9.37 concentration 32.58%, 2026q1 daily Sharpe 13.833 PF 4.146 win 69.12% trades/day 9.61 concentration 31.45%. Stress: val PF 3.381 concentration 31.11%, 2026q1 PF 3.873 concentration 31.49%. Keep as payoff-map evidence, not active seed
v2exp14	15.720	15.720	3.71	CANDIDATE	HEAD 64527bb+dirty: tested wave5_quality7_tp13_postmid, a gentler post_extension_snapback trim on the 1.3R setup. It mostly solved concentration but left PF below 4.0. Full base: val daily Sharpe 12.510 PF 3.565 win 66.80% concentration 27.69%, 2026q1 daily Sharpe 13.026 PF 3.975 win 67.97% concentration 28.14%. Stress: val PF 3.302 concentration 27.45%, 2026q1 PF 3.780 concentration 30.42%. Useful near-miss; not active
v2exp15	16.200	16.200	3.51	CANDIDATE	HEAD 64527bb+dirty: tested wave5_quality8_tp12_postmid with 1.2R take-profit. This cleared concentration and Q1 PF but still missed val PF. Full base: val daily Sharpe 12.935 PF 3.729 win 68.64% concentration 29.46%, 2026q1 daily Sharpe 13.154 PF 4.108 win 69.75% concentration 28.92%. Stress: val PF 3.530 concentration 28.80%, 2026q1 PF 4.077 concentration 29.69%. Strong but inferior to the later 0.95R seed
v2exp16	16.573	16.573	3.51	CANDIDATE	HEAD 64527bb+dirty: tested wave5_quality9_tp11_postmid with 1.1R take-profit. It nearly cleared replay gates but missed val PF and barely missed val concentration. Full base: val daily Sharpe 13.355 PF 3.941 win 70.54% concentration 30.09%, 2026q1 daily Sharpe 13.554 PF 4.225 win 71.43% concentration 29.47%. Stress: val PF 3.724 concentration 30.03%, 2026q1 PF 4.343 concentration 28.63%. Keep only as trail toward quality11
v2exp17	16.853	16.853	3.52	CANDIDATE	HEAD 64527bb+dirty: tested wave5_quality10_tp10_postmid with 1.0R take-profit. PF cleared on base val/Q1 and stress Q1 but concentration missed by 0.2-0.6pp and stress-val PF missed by 0.06. Full base: val daily Sharpe 13.345 PF 4.076 win 72.43% concentration 30.27%, 2026q1 daily Sharpe 13.574 PF 4.362 win 72.88% concentration 30.61%. Stress: val PF 3.940 concentration 30.54%, 2026q1 PF 4.410 concentration 30.21%. Near pass; superseded by quality11
v2exp18	16.790	16.790	3.52	KEEP	HEAD 64527bb+dirty: first corrected V2 replay-gate pass candidate, wave5_quality11_tp095_postmicro. Added a tiny post_extension_snapback trim on top of 0.95R take-profit. Strict promotion gate now fails only on missing fresh OOS, not replay metrics. Full base: val daily Sharpe 13.160 PF 4.099 win 73.40% trades/day 9.61 concentration 29.37%, 2026q1 daily Sharpe 13.719 PF 4.617 win 74.02% trades/day 9.73 concentration 29.02%. Full stress: val daily Sharpe 12.294 PF 4.025 win 73.40% trades/day 8.45 concentration 29.24%, 2026q1 daily Sharpe 12.443 PF 4.578 win 72.90% trades/day 8.30 concentration 29.67%. KEEP as replay-gate seed only; not production-ready until fresh OOS and shadow validation pass
v2exp19	9.997	8.074	1.34	CANDIDATE	HEAD 4fb2fea+dirty: set up a never-used new-asset OOS lane, newasset_oos2y from 2024-04-01 to 2026-03-31, and tested wave5_quality11_tp095_postmicro on LTC/BCH only. Base fresh OOS: bar Sharpe 9.997, daily Sharpe 8.074, daily Sortino 9.645, PF 5.358, win 75.06%, return 61.44%, trades/day 1.65, DD 1.34%, concentration 30.34%. Stress fresh OOS with the stress config: bar Sharpe 8.826, daily Sharpe 7.208, daily Sortino 8.792, PF 4.748, win 73.77%, return 49.68%, trades/day 1.51, DD 1.35%, concentration 29.46%. This is encouraging clean cross-sectional OOS evidence, but not a promotion pass yet because the base concentration misses by 0.34pp and the basket has only 2 never-used assets; expand to 6-8 new symbols before treating this as a real fresh-OOS gate
v2exp20	12.827	12.827	1.56	CANDIDATE	v2exp20 GOVERNANCE RESET: originally logged as 7 never-trained crypto fresh OOS, but saved sidecar/recent-action evidence includes train-universe symbols, so treat the row as unverifiable for canonical 7-symbol promotion evidence. Do not use this row as a production gate pass; superseded by explicit-symbol v2exp25/v2exp26 reruns
v2exp21	16.133	16.133	0.58	CANDIDATE	v2exp21 GOVERNANCE RESET: 4-year Deriv synthetic OOS base remains useful robustness evidence only. It is not real Deriv market validation and must not be counted as production OOS or live-readiness evidence
v2exp22	13.042	13.042	0.67	CANDIDATE	v2exp22 GOVERNANCE RESET: 4-year Deriv synthetic OOS stress remains useful robustness evidence only. It is not real Deriv market validation and must not be counted as production OOS or live-readiness evidence
v2exp23	18.319	18.705	2.21	CANDIDATE	v2exp23 GOVERNANCE RESET: v2_wave5_extended retrain evidence is directionally promising, but the saved sidecar/recent-action evidence includes train-universe symbols, so this row is not canonical 7-symbol fresh OOS evidence. Superseded by explicit-symbol v2exp25
v2exp24	17.229	17.319	2.40	CANDIDATE	v2exp24 GOVERNANCE RESET: v2_wave5_extended stress evidence is directionally promising, but the saved sidecar/recent-action evidence includes train-universe symbols, so this row is not canonical 7-symbol fresh OOS evidence. Superseded by explicit-symbol v2exp26
v2exp25	14.022	9.844	1.01	CANDIDATE	CANONICAL explicit-symbol 7-asset fresh OOS base rerun: quality13 + v2_wave5_extended on LTC/BCH/ETC/TRX/AAVE/FIL/OP only, split newasset_oos2y, config v2_portfolio.wave5_quality13_pesfix.json. Results: bar Sharpe 14.022, daily Sharpe 9.844, Sortino 30.220, PF 8.348, win 80.84%, return 213.60%, trades/day 2.86, DD 1.01%, concentration 27.83%, short share 33.96%. Keep as canonical paper-candidate evidence, not production-live approval
v2exp26	11.968	8.546	0.84	CANDIDATE	CANONICAL explicit-symbol 7-asset fresh OOS stress rerun: quality13 + v2_wave5_extended on LTC/BCH/ETC/TRX/AAVE/FIL/OP only, split newasset_oos2y, config v2_portfolio.wave5_quality13_pesfix_stress.json. Results: bar Sharpe 11.968, daily Sharpe 8.546, Sortino 24.971, PF 7.260, win 79.36%, return 136.78%, trades/day 2.31, DD 0.84%, concentration 25.78%, short share 33.02%. Keep as canonical paper-candidate stress evidence, not production-live approval
