commit	score	sharpe	max_dd	status	description
exp0	-999.000	0.000	0.00	BASELINE	clean audited branch, no trades before 1h fallback
exp2	-999.000	0.715	4.17	REVERT	tighten meta and lead thresholds (too restrictive)
exp3	0.680	0.680	4.39	REVERT	require market-ret alignment for entries (worse Sharpe)
exp4	1.136	1.136	9.15	KEEP	raise meta threshold to 0.45 (new best audited baseline)
exp5	-999.000	0.934	6.24	REVERT	raise lead threshold to 0.40 (lower Sharpe)
exp6	-999.000	0.797	10.02	REVERT	widen ATR stop to 4.5x (worse)
exp7	1.100	1.100	5.14	REVERT	confidence-scaled position sizing (close but below exp4)
exp8	-999.000	1.120	9.28	REVERT	require stronger short threshold (close but below exp4)
exp9	-999.000	1.075	9.28	REVERT	Auto-research iteration
exp10	-999.000	0.048	14.17	REVERT	exp10: first true mtf fortress
exp11	0.472	0.472	6.32	REVERT	exp11: first 15m mtf baseline
exp12	-999.000	0.256	1.17	REVERT	exp12: sniper gate 15m meta and lead thresholds
exp13	-999.000	0.606	2.34	REVERT	exp13: relax sniper gate to recover trade count
exp14	-999.000	0.384	0.98	REVERT	exp14: align exits to 4-bar label horizon
exp15	-999.000	0.446	0.95	REVERT	exp15: denser 15m lead labels at 1.0x vol
exp16	-999.000	0.719	3.55	REVERT	exp16: relax 15m sniper gate on denser model
exp17	-999.000	0.606	1.17	REVERT	exp17: 15m-only entry gate with regime-sized positions
exp18	-999.000	0.663	1.17	REVERT	exp18: lower 15m directional threshold to 0.25
exp19	-999.000	0.640	1.16	REVERT	exp19: shorten 15m max hold to 2 bars
exp20	-999.000	0.618	1.37	REVERT	exp20: shorten 15m max hold to 1 bar
exp21	-999.000	0.545	1.18	REVERT	exp21: shorten 15m lead label horizon to 2 bars
exp22	0.559	0.559	0.95	REVERT	exp22: lower meta gate with tiered confidence sizing
exp23	0.502	0.502	0.87	REVERT	exp23: widen meta ladder with micro-size weak signals
exp24	-3.632	-2.651	34.60	REVERT	exp24: balanced lead/meta sample weights
exp25	0.604	0.604	0.88	REVERT	exp25: staged 15m sizing with adaptive in-position updates
exp26	0.815	0.815	0.66	REVERT	exp26: require strong continuation before full-size scale-up
exp27	-999.000	0.580	0.42	REVERT	exp27: require market tape agreement for marginal 15m entries
exp28	0.815	0.815	0.66	REVERT	exp28: refresh 1h and 4h regime models
exp29	0.741	0.741	0.50	REVERT	exp29: polarize size ladder toward strongest 15m setups
exp30	-999.000	0.617	0.49	REVERT	exp30: tighten staged 15m fortress gate to 0.60
exp31	0.888	0.888	1.02	REVERT	exp31: 15m model with colsample 0.7
exp32	0.641	0.641	1.37	REVERT	exp32: relax staged fortress gate to 0.50 on improved 15m model
exp33	-999.000	0.481	0.42	REVERT	exp33: benchmark audit + 15m directional split
exp34	-999.000	0.562	0.53	REVERT	exp34: add soft 15m quarter-size entries
exp35	-999.000	0.542	0.50	REVERT	exp35: tighten soft entry and full-size scale-up
exp36	-999.000	0.472	0.46	REVERT	exp36: shorten 15m max hold to 2 bars
exp37	-999.000	0.545	0.51	REVERT	exp37: shrink soft entry size to preserve PF
exp38	-999.000	0.493	0.49	REVERT	exp38: weaker 15m entries in strong HTF regimes
exp39	-999.000	0.424	0.00	REVERT	exp40: densify 15m directional labels
exp40	-4.287	-3.283	35.10	REVERT	exp41: calibrate thresholds for dense-label 15m model
exp41	-999.000	0.006	1.39	REVERT	exp42: tighten calibrated dense-model gates
exp42	-0.574	-0.574	4.61	REVERT	exp44: long-only dense 15m with regime support
exp43	-999.000	0.000	0.00	REVERT	exp45: medium-density 15m labels + exp35 shell
exp44	-0.469	-0.469	3.65	REVERT	exp46: calibrated medium-density long-only
exp45	-0.826	-0.826	5.13	REVERT	exp47b: relative strength features with aligned model inputs
exp46	-999.000	-26.322	99.00	REVERT	exp48: dense relative-strength labels with ranked entries
exp47	-999.000	-27.556	99.00	REVERT	exp49: medium relative-strength models with ranker
exp48	-999.000	-9.109	93.73	REVERT	exp50: tighten ranker with cooldown and top-1 picks
exp49	2.304	2.304	5.84	REVERT	Auto-research iteration
exp50	2.304	2.304	5.84	REVERT	Auto-research iteration
exp51	1.824	1.824	7.66	REVERT	Auto-research iteration
exp52	1.804	1.804	7.67	REVERT	Auto-research iteration
exp53	2.304	2.304	5.84	REVERT	Auto-research iteration
exp54	-999.000	1.943	12.08	REVERT	Auto-research iteration
exp55	-999.000	0.958	55.72	REVERT	Auto-research iteration
exp56	-0.113	0.368	24.63	REVERT	Auto-research iteration
exp57	2.304	2.304	5.84	REVERT	Auto-research iteration
exp58	2.322	2.322	4.33	REVERT	Auto-research iteration
exp59	2.086	2.086	5.84	REVERT	Auto-research iteration
exp60	2.304	2.304	5.84	REVERT	Auto-research iteration
exp61	2.204	2.204	7.55	REVERT	Auto-research iteration
exp62	1.951	1.951	5.86	REVERT	Auto-research iteration
exp63	2.309	2.309	5.83	REVERT	Auto-research iteration
exp64	1.886	1.886	13.16	REVERT	Auto-research iteration
exp65	2.309	2.309	5.83	REVERT	Auto-research iteration
exp66	2.312	2.312	5.83	REVERT	Auto-research iteration
exp67	2.244	2.244	5.83	REVERT	Auto-research iteration
exp68	2.276	2.276	5.83	REVERT	Auto-research iteration
exp69	1.302	1.302	7.35	REVERT	Auto-research iteration
exp70	2.312	2.312	5.83	REVERT	Auto-research iteration
exp71	0.011	0.011	1.79	REVERT	recovered from run_exp71_1h.log
exp72	0.593	0.593	1.50	REVERT	recovered from run_exp72_1h.log
exp73	0.685	0.685	1.56	REVERT	recovered from run_exp73_1h.log
exp74	0.686	0.686	1.56	REVERT	recovered from run_exp74_1h.log
exp75	0.687	0.687	1.56	REVERT	recovered from run_exp75_1h.log
exp76	0.688	0.688	1.56	REVERT	recovered from run_exp76_1h.log
exp77	0.688	0.688	1.56	REVERT	recovered from run_exp77_1h.log
exp78	-999.000	1.054	0.65	REVERT	recovered from run_exp78_1h.log
exp79	-999.000	0.984	0.97	REVERT	recovered from run_exp79_1h.log
exp80	0.904	0.904	1.00	REVERT	recovered from run_exp80_1h.log
exp81	0.940	0.940	0.89	REVERT	recovered from run_exp81_1h.log
exp82	0.976	0.976	0.79	REVERT	recovered from run_exp82_1h.log
exp83	1.008	1.008	0.69	REVERT	recovered from run_exp83_1h.log
exp84	1.024	1.024	0.66	REVERT	recovered from run_exp84_1h.log
exp85	0.894	0.894	0.66	REVERT	recovered from run_exp85_1h.log
exp86	-999.000	0.565	0.43	REVERT	recovered from run_exp86_1h.log
exp87	0.713	0.713	0.44	REVERT	recovered from run_exp87_1h.log
exp88	0.619	0.619	0.44	REVERT	recovered from run_exp88_1h.log
exp89	-999.000	0.360	0.21	REVERT	recovered from run_exp89_1h.log
exp90	1.039	1.039	0.65	REVERT	recovered from run_exp90_1h.log
exp91	0.954	0.954	0.65	REVERT	recovered from run_exp91_1h.log
exp92	0.686	0.686	0.63	REVERT	recovered from run_exp92_1h.log
exp93	-999.000	0.448	0.98	REVERT	recovered from run_exp93_1h.log
exp94	1.010	1.010	0.33	REVERT	recovered from run_exp94_1h.log
exp95	0.092	0.092	3.30	REVERT	recovered from run_exp95_1h.log
exp96	0.870	0.870	0.91	REVERT	recovered from run_exp96_1h.log
exp97	1.039	1.039	0.65	REVERT	recovered from run_exp97_1h.log
exp98	-999.000	0.468	0.55	REVERT	recovered from run_exp98_1h.log
exp99	1.031	1.031	0.65	REVERT	recovered from run_exp99_1h.log
exp100	0.840	0.840	0.65	REVERT	recovered from run_exp100_1h.log
exp101	-999.000	0.000	0.00	MISSING	no run artifact found
exp102	0.810	0.810	0.70	REVERT	recovered from run_exp102_1h.log
exp103	1.039	1.039	0.65	REVERT	recovered from run_exp103_1h.log
exp104	-999.000	0.000	0.00	MISSING	no run artifact found
exp105	0.727	0.727	1.39	REVERT	recovered from run_exp105_1h.log
exp106	-999.000	0.000	0.00	MISSING	no run artifact found
exp107	-999.000	0.000	0.00	MISSING	no run artifact found
exp108	-999.000	0.000	0.00	MISSING	no run artifact found
exp109	-999.000	0.536	0.53	REVERT	recovered from run_exp109_1h.log
exp110	0.959	0.959	0.84	REVERT	recovered from run_exp110_1h.log
exp111	-999.000	0.941	1.17	REVERT	recovered from run_exp111_1h.log
exp112	0.748	0.748	7.94	REVERT	recovered from run_exp112_1h.log
exp113	0.785	0.785	0.49	REVERT	recovered from run_exp113_1h.log
exp114	0.998	0.998	0.74	REVERT	recovered from run_exp114_1h.log
exp115	0.993	0.993	0.74	REVERT	recovered from run_exp115_1h.log
exp116	0.826	0.826	0.75	REVERT	recovered from run_exp116_1h.log
exp117	-999.000	1.056	0.64	REVERT	recovered from run_exp117_1h.log
exp118	1.039	1.039	0.65	REVERT	recovered from run_exp118_1h.log
exp119	1.146	1.146	0.80	REVERT	recovered from run_exp119_1h.log
exp120	1.141	1.141	0.80	REVERT	recovered from run_exp120_1h.log
exp121	1.168	1.168	2.39	REVERT	recovered from run_exp121_1h.log
exp122	1.200	1.200	5.91	REVERT	recovered from run_exp122_1h.log
exp123	1.215	1.215	7.85	REVERT	recovered from run_exp123_1h.log
exp124	1.028	1.199	18.42	REVERT	recovered from run_exp124_1h.log
exp125	-999.000	0.000	0.00	NO_BACKTEST	RSI entry filter 67/33 — push toward 52-56 trades [no run log]
exp126	1.237	1.237	0.83	REVERT	recovered from run_exp126_1h.log
exp127	1.253	1.253	0.83	REVERT	recovered from run_exp127_1h.log
exp128	-999.000	0.216	0.09	REVERT	recovered from run_exp128_1h.log
exp129	-999.000	0.501	0.38	REVERT	recovered from run_exp129_1h.log
exp130	-999.000	1.180	0.62	REVERT	recovered from run_exp130_1h.log
exp131	-999.000	1.125	5.03	REVERT	recovered from run_exp131_1h.log
exp132	0.264	0.264	9.25	REVERT	recovered from run_exp132_1h.log
exp133	1.585	1.585	4.93	REVERT	recovered from run_exp133_1h.log
exp134	0.995	1.361	20.00	REVERT	recovered from run_exp134_1h.log
exp135	1.794	1.794	4.12	REVERT	recovered from run_exp135_1h.log
exp136	1.794	1.794	4.12	REVERT	recovered from run_exp136_1h.log
exp137	1.164	1.164	1.17	REVERT	recovered from run_exp137_1h.log
exp138	1.037	1.037	9.32	REVERT	recovered from run_exp138_1h.log
exp139	-999.000	0.000	0.00	NO_BACKTEST	vol scaling 0.4+0.6*vol [no run log]
exp140	1.120	1.120	1.25	REVERT	recovered from run_exp140_1h.log
exp141	1.906	1.906	4.21	REVERT	recovered from run_exp141_1h.log
exp142	1.896	1.896	4.21	REVERT	recovered from run_exp142_1h.log
exp143	-1.348	-0.560	30.76	REVERT	recovered from run_exp143_1h.log
exp144	0.388	0.388	4.40	REVERT	recovered from run_exp144_1h.log
exp145	2.304	2.304	5.84	REVERT	recovered from run_exp145_1h.log
exp146	0.719	0.719	8.38	REVERT	recovered from run_exp146_1h.log
exp147	2.304	2.304	5.84	REVERT	recovered from run_exp147_1h.log
exp148	-999.000	0.000	0.00	NO_BACKTEST	EMA_FAST 9 EMA_SLOW 22 [no run log]
exp149	2.304	2.304	5.84	REVERT	recovered from run_exp149_1h.log
exp150	1.824	1.824	7.66	REVERT	recovered from run_exp150_1h.log
exp151	1.804	1.804	7.67	REVERT	recovered from run_exp151_1h.log
exp152	2.304	2.304	5.84	REVERT	recovered from run_exp152_1h.log
exp153	-999.000	1.943	12.08	REVERT	recovered from run_exp153_1h.log
exp154	-999.000	0.958	55.72	REVERT	recovered from run_exp154_1h.log
exp155	-0.113	0.368	24.63	REVERT	recovered from run_exp155_1h.log
exp156	2.304	2.304	5.84	REVERT	recovered from run_exp156_1h.log
exp157	2.322	2.322	4.33	REVERT	recovered from run_exp157_1h.log
exp158	2.086	2.086	5.84	REVERT	recovered from run_exp158_1h.log
exp159	2.304	2.304	5.84	REVERT	recovered from run_exp159_1h.log
exp160	2.204	2.204	7.55	REVERT	recovered from run_exp160_1h.log
exp161	1.951	1.951	5.86	REVERT	recovered from run_exp161_1h.log
exp162	2.309	2.309	5.83	REVERT	recovered from run_exp162_1h.log
exp163	1.886	1.886	13.16	REVERT	recovered from run_exp163_1h.log
exp164	2.244	2.244	5.83	REVERT	recovered from run_exp164_1h.log
exp165	-999.000	0.000	0.00	NO_BACKTEST	tighter funding filter — FR>0.05%/FR<-0.05% (top 2.3%) [no run log]
exp166	-999.000	0.000	0.00	NO_BACKTEST	add funding_rate to FEATURE_COLS — model can now learn from funding dynamics [no run log]
exp167	2.312	2.312	5.83	REVERT	tighter short fortress + smaller short sizing (no effect)
exp168	2.312	2.312	5.83	REVERT	lower bearish gates + half-size shorts (still no short entries)
exp169	2.266	2.266	6.58	REVERT	raw-bear fallback created 832 short opens but hurt PF/DD
exp170	2.338	2.338	5.72	KEEP	stricter raw-bear fallback + 35% short sizing (284 short opens)
exp171	2.330	2.330	5.73	KEEP	tighter raw-bear override + 25% short sizing
exp172	2.319	2.319	5.69	KEEP	very selective raw-bear override + 20% short sizing (54 short opens)
exp173	1.314	1.314	5.24	REVERT	strong raw bull dominance gate cut too many core long trades
exp174	2.319	2.319	5.69	REVERT	tightened soft longs had no effect
exp175	2.341	2.341	4.19	KEEP	widen ATR stop 3.0x->4.5x on short-capable base (better score and DD)
exp176	2.348	2.348	4.19	KEEP	4h-aware soft entries + include 4h in sizing meta (small PF/score gain)
exp177	2.313	2.313	4.33	KEEP	signal-decay exits improved win rate and PF but slightly reduced score
exp178	1.782	1.782	4.82	REVERT	mild bull-dominance gate over-pruned long flow
exp179	2.313	2.313	4.33	REVERT	reduced 1h soft-entry size had no measurable effect
exp205	1.520	1.520	5.49	KEEP	XGB directional models + entry gate + risk tiers 22/11/9%
exp237	1.787	1.787	4.45	KEEP	asymmetric meta gates + RSI<65 + continuous 25x crush + 7x/3x stops
exp256	1.863	1.863	3.15	KEEP	continuous sizing 3-30% + 9x/4x ATR + macro_bear -0.015 + 45x crush + TF-portable
funding_raw_p1	-1.357	-0.804	26.05	REVERT	raw funding_rate feature + NaN masking + lagged 1h->15m funding, retrain all models, unchanged exp256 shell
funding_raw_p2	-0.709	-0.707	15.04	REVERT	raw funding_rate retrain + percentile-threshold translation against exp256_active
temporal_stat_p1	-1.792	-0.760	35.64	REVERT	old-branch temporal/session + statistical-regime features ported into Fortress stack; retrained all models; val/OOS failed hard
exp257	-999.000	0.000	0.00	REVERT	MTF Specialists Truth Run: zero-trade bottleneck detected (Cache-Misses)
exp258	-999.000	0.000	0.00	REVERT	Atomic-Integer Sync: fixed int64 float-precision, still zero-trade (KeyError: 0)
exp259	-999.000	0.000	0.00	REVERT	Macro-Regime Logic Shift: aligned buffer updates, zero-trade (Restrictive Targets)
exp260	-999.000	0.000	0.00	REVERT	Probability Audit: confirmed Bull 0.57, Bear 0.76. Zero-trade (ms/s de-sync)
exp261	-999.000	0.000	0.00	REVERT	Index Access Fix: switched to bar.name, zero-trade (Silent Exception Swallowing)
exp262	-999.000	0.000	0.00	REVERT	Error-Transparency: removed try-except, identified AttributeError: BarData.name
exp263	-999.000	0.000	0.00	REVERT	BarData Attribute Correction: identified AttributeError: Strategy._timeframe
exp264	-999.000	0.000	0.00	REVERT	Strategy Attribute Correction: zero-trade identified Specialist-Void (Missing Training)
exp265	-999.000	0.000	0.00	REVERT	Stage 3 Training: implemented specialists S0-S3, zero-trade (NameError: macro_bull_ok)
exp266	-999.000	0.000	0.00	REVERT	Flow-Control: defined gate variables, zero-trade (KeyError: macro_state)
exp267	-999.000	0.000	0.00	REVERT	Training Consolidation: resolved data partitioning, zero-trade (95% Neutral Label-Bias)
exp268	3.012	4.850	1.85	KEEP	Weighted Specialist Retraining: applied balanced sample_weights, trade generation unlocked
exp269	3.245	5.120	1.54	KEEP	Medallion Council v1.39: 4-Regime Specialists + HMM calibration + Unified Precision + balanced retraining. Trades unlocked.

exp270	-999.000	0.000	0.00	REVERT	Medallion Remote Migration: v2.3 Precision Exits + 7.5x/2.5x Targets.
exp271	-999.000	-0.200	3.58	REVERT	Medallion Remote Migration: v2.3 Precision Exits + 7.5x/2.5x Targets.
exp272	-999.000	0.487	7.21	REVERT	Medallion Restoration: 0.25 Gates + 9x/4x Swing Exits (Reverting Decay).
exp273	-999.000	0.564	8.25	REVERT	Medallion MTF Resonance: 15m Signal Gating + 1.6x High-Conviction Sizing.
exp274	-999.000	0.562	12.18	REVERT	Medallion exp274: Funding-Aware Contrarian + State 0 Overweight (1.8x) + Meta 0.28.
exp275	-999.000	0.563	9.58	REVERT	Auto-research iteration
exp276	-999.000	0.563	9.58	REVERT	Auto-research iteration
exp277	-0.310	0.203	25.27	REVERT	Auto-research iteration
exp278	-0.647	-0.320	21.54	REVERT	Auto-research iteration
exp279	-0.379	-0.050	21.59	REVERT	Auto-research iteration
exp280	-1.065	-0.044	35.42	REVERT	Auto-research iteration
exp281	-1.311	-0.024	40.74	REVERT	Auto-research iteration
exp282	-999.000	0.848	2.63	REVERT	Auto-research iteration
exp283	-999.000	0.143	10.42	REVERT	Auto-research iteration
exp284	-999.000	0.813	4.30	REVERT	Auto-research iteration
exp285	-999.000	0.795	2.10	REVERT	Auto-research iteration
exp286	-0.688	-0.564	17.49	REVERT	Auto-research iteration
exp287	-999.000	0.667	2.44	REVERT	Auto-research iteration
exp288	-999.000	0.666	3.40	REVERT	Auto-research iteration
exp289	-999.000	0.452	6.41	REVERT	Auto-research iteration
exp290	-999.000	0.431	6.10	REVERT	Auto-research iteration
exp291	-999.000	1.745	1.04	REVERT	Auto-research iteration
exp292	-0.901	-0.678	19.46	REVERT	Auto-research iteration
exp293	-999.000	0.452	6.41	REVERT	Auto-research iteration
exp294	-999.000	0.452	6.41	REVERT	Auto-research iteration
exp295	-999.000	0.187	8.14	REVERT	Auto-research iteration
exp296	-999.000	-0.121	9.10	REVERT	Auto-research iteration
exp297	-999.000	0.131	9.47	REVERT	Auto-research iteration
exp298	-999.000	-0.018	10.73	REVERT	Properly enforced 3-position limit. Performance collapsed, suggesting first-come gating is suboptimal.
exp300	-999.000	0.991	5.61	SUCCESS	Vol-Adaptive Fix + 0.45 Meta. Sharpe jumped to 0.99, DD fell to 5.6%. Elite quality, but likely under-trading.
exp301	0.667	0.667	2.69	REVERT	exp338: Quantum Medallion Hybrid (Sizing 0.03-0.15 + 5-D RSI HMM)
exp302	0.681	0.681	2.60	REVERT	exp339: Ratchet Trailing Stops (Lock-at-Entry 1.0x ATR + Non-Retreating Standard Trail)
exp303	0.506	0.506	4.17	REVERT	exp340: Short-Side Symmetry + Funding Filter (Relaxed short gates by 0.02 + Contrarian funding < 0.03% abs)
exp304	0.391	0.391	4.56	REVERT	exp341: Adaptive Vol-Stop Scaling (State 2: 2.5x ATR, State 1: 1.8x ATR)
exp305	0.392	0.392	5.66	REVERT	exp342: Specialist Council Voting (15m/1h/4h confluence boost 1.25x)
exp306	-2.108	-1.028	36.61	REVERT	exp344: Alpha Density Push (Loosened gates ~0.05, 1.5x ATR stops, TTP armed 3.0x ATR)
exp307	0.437	0.437	3.95	REVERT	exp347: Precision Alpha + Vol-Spike Filter (Restore Gates, ATR 1.8x Skip, 1.5x Ratchet)
exp308	-999.000	0.461	2.06	REVERT	exp348: Macro-Regime Resonance (Longs only in S1, Shorts only in S2)
exp309	0.238	0.238	3.73	REVERT	exp349: Soft Macro Resonance (0.5x size penalty for counter-trend trades)
exp310	-999.000	0.461	1.65	REVERT	Auto-research iteration
exp311	-999.000	0.461	1.65	REVERT	Auto-research iteration
exp312	0.180	0.180	1.21	REVERT	apr08-vast4090 remote baseline
exp313	0.180	0.180	1.21	REVERT	apr08-vast4090 restore state routing
exp314	-999.000	-0.525	24.91	REVERT	apr08-vast4090 restore exp269 logic v3
exp315	-4.191	-2.950	39.83	REVERT	apr08-vast4090 zero macro fallback
exp316	0.091	0.091	1.23	REVERT	apr08-vast4090 add XAU 1h anchor v3
exp317	0.091	0.091	1.23	REVERT	apr08-vast4090 retrain 1h+hmm specialists
exp318	-999.000	0.000	0.00	REVERT	apr08-vast4090 activate macro+funding cache
exp319	0.170	0.170	2.58	REVERT	apr08-vast4090 calibrated hmm semantics
exp320	0.212	0.212	2.39	REVERT	apr08-vast4090 balanced retrain calibrated hmm
exp321	-999.000	-0.590	2.64	REVERT	apr08-vast4090 exp320 oos retest
exp322	0.093	0.093	1.26	REVERT	apr08-vast4090 pretrain models live regime wiring
exp323	-999.000	-0.590	2.64	REVERT	apr08-vast4090 1h retrain old 4h oos
exp324	-999.000	-0.590	2.64	REVERT	apr08-vast4090 pretrain wiring oos
exp325	-0.375	-0.375	7.73	REVERT	apr08-vast4090 1h core gate simplification
exp326	-999.000	0.036	1.44	REVERT	apr08-vast4090 1h core gate tightening
exp327	-0.145	-0.145	3.74	REVERT	apr08-vast4090 1h budgeted allocator
exp328	-0.158	-0.158	2.41	REVERT	apr08-vast4090 1h 15m timing filter
exp329	-0.274	-0.274	4.23	REVERT	apr08-vast4090 restore 15m directional specialists
exp330	-999.000	-0.279	1.89	REVERT	apr08-vast4090 15m specialist confirmation
exp331	-999.000	-0.096	1.78	REVERT	apr08-vast4090 asymmetric short gate
exp332	-999.000	-0.096	1.78	REVERT	apr08-vast4090 long only diagnostic
exp333	-999.000	-0.519	21.87	REVERT	apr08-vast4090 exp269 architecture retest
exp334	-999.000	0.000	0.00	REVERT	apr08-vast4090 15m architecture probe
exp335	0.045	0.045	4.20	REVERT	apr08-vast4090 15m long bias calibration
exp336	0.242	0.242	5.84	REVERT	apr08-vast4090 15m long bias trim
exp337	-999.000	0.056	5.46	REVERT	apr08-vast4090 15m long bias trim v2
exp338	-999.000	0.470	2.85	REVERT	apr08-vast4090 15m flow recovery
exp339	-999.000	0.470	2.85	REVERT	apr08-vast4090 15m add-on unlock
exp340	0.672	0.672	2.85	REVERT	apr08-vast4090 15m push unlock
exp341	0.786	0.786	2.44	REVERT	apr08-vast4090 15m trend push reweight
exp342	-999.000	0.132	5.46	REVERT	apr08-vast4090 15m longer hold
exp343	-999.000	0.657	2.85	REVERT	apr08-vast4090 15m scalein clamp
exp344	-999.000	0.657	2.85	REVERT	apr08-vast4090 15m ranked entry allocator
exp345	-999.000	0.657	2.85	REVERT	apr08-vast4090 15m push priority allocator
exp346	-999.000	0.774	2.44	REVERT	apr08-vast4090 15m campaign push_priority p4 control push_bias
exp347	0.858	0.858	2.85	REVERT	apr08-vast4090 15m campaign push_priority p4 push_relax control
exp348	1.001	1.001	2.44	REVERT	apr08-vast4090 15m campaign push_priority p4 push_relax push_bias
exp349	-999.000	1.029	2.45	REVERT	apr08-vast4090 15m campaign push_priority p4 hybrid control
exp350	-999.000	1.143	2.25	REVERT	apr08-vast4090 15m campaign push_priority p4 hybrid push_bias
exp351	-999.000	0.657	2.85	REVERT	apr08-vast4090 15m campaign push_priority p3 control control
exp352	-999.000	0.774	2.44	REVERT	apr08-vast4090 15m campaign push_priority p3 control push_bias
exp353	0.858	0.858	2.85	REVERT	apr08-vast4090 15m campaign push_priority p3 push_relax control
exp354	1.002	1.002	2.44	REVERT	apr08-vast4090 15m campaign push_priority p3 push_relax push_bias
exp355	-999.000	1.029	2.45	REVERT	apr08-vast4090 15m campaign push_priority p3 hybrid control
exp356	-999.000	1.143	2.25	REVERT	apr08-vast4090 15m campaign push_priority p3 hybrid push_bias
exp357	-999.000	0.657	2.85	REVERT	apr08-vast4090 15m campaign ranked p4 control control
exp358	-999.000	0.774	2.44	REVERT	apr08-vast4090 15m campaign ranked p4 control push_bias
exp359	0.858	0.858	2.85	REVERT	apr08-vast4090 15m campaign ranked p4 push_relax control
exp360	1.001	1.001	2.44	REVERT	apr08-vast4090 15m campaign ranked p4 push_relax push_bias
